### ISSUE TITLE
Feature request: Add DNS A record for dns plugin (flow_meter) 

### ISSUE THREAD

**Issue by whitetiger21022014** [CESNET/Nemea-Modules#35]
Dear Nemea Team,
With dns plugin (flow_meter) it shows as below ( test and capture external interface of OpenWRT)
Can't get mapping between domain name <---> A record

8.8.8.8,192.168.2.51,0,0,2017-02-16T02:31:12.070,2017-02-16T02:31:12.070,0,1,0,1,16817,0,1,0,53,28110,0,0,0,17,0,0,64,"checkip.org",
8.8.8.8,192.168.2.51,0,0,2017-02-16T02:31:12.070,2017-02-16T02:31:12.070,0,1,0,1,16817,0,1,0,53,28110,0,0,0,17,0,0,64,"checkip.org",

Could you add A-record field like below  for **passiveDNS purpose** ?
Example tcpdump -i eth1 dst port 53
09:32:00.505589 IP 192.168.111.138.45145 > 192.168.111.2.domain: 6718+ A? checkip.org. (29)
09:32:00.505759 IP 192.168.111.138.45145 > 192.168.111.2.domain: 51489+ AAAA? checkip.org. (29)
09:32:00.506371 IP 192.168.111.138.39505 > 192.168.111.2.domain: 60537+ PTR? 2.111.168.192.in-addr.arpa. (44)
09:32:00.506832 IP 192.168.111.2.domain > 192.168.111.138.45145: 6718 1/0/0 **A 52.202.215.126** (45)
09:32:00.507176 IP 192.168.111.2.domain > 192.168.111.138.45145: 51489 0/0/0 (29)
09:32:00.508841 IP 192.168.111.2.domain > 192.168.111.138.39505: 60537 NXDomain 0/0/0 (44)
09:32:00.509250 IP 192.168.111.138.50612 > 192.168.111.2.domain: 43979+ PTR? 138.111.168.192.in-addr.arpa. (46)

Thanks,
